{
  "$schema": "http://json-schema.org/draft-07/schema#",
  "title": "Recommendation Feedback (feedback.jsonl record)",
  "description": "One JSON object per line in outputs/feedback.jsonl, exactly as written by save_feedback() in the local interface. Feedback is local-only and is aggregated by generate_recommendations.py to gently nudge future scoring.",
  "type": "object",
  "required": ["timestamp", "action"],
  "additionalProperties": true,
  "properties": {
    "timestamp": {
      "type": "string",
      "format": "date-time",
      "description": "ISO 8601 UTC timestamp written when the reaction was saved."
    },
    "action": {
      "type": "string",
      "enum": ["like", "not_for_me", "too_similar", "too_strange", "more_like_this"],
      "description": "The reaction. 'like'/'more_like_this' boost the track's genres and artist; 'not_for_me' lowers them; 'too_similar'/'too_strange' shift the novelty distance."
    },
    "track_title": { "type": "string", "description": "Title of the recommended track the reaction applies to." },
    "artist": { "type": "string", "description": "Artist of the recommended track (used for artist-level feedback weighting)." },
    "genres": { "type": "array", "items": { "type": "string" }, "description": "Genres of the track (used for genre-level feedback weighting)." },
    "group": { "type": "string", "description": "Group the track was shown in (safe_match, adjacent_discovery, wildcard)." },
    "mood": { "type": ["number", "null"], "minimum": -2, "maximum": 2, "description": "Mood score active during the run." },
    "task": { "type": "string", "description": "Task/use-case active during the run." },
    "experimentality": { "type": ["integer", "null"], "minimum": 1, "maximum": 5, "description": "Experimentality (novelty) level active during the run." },
    "source": { "type": "string", "description": "Source label of the run (e.g. demo library, Spotify, upload)." },
    "reason": { "type": "string", "description": "Optional free-text note explaining the reaction." }
  }
}
